,ID,TEXT,PET,LABEL,EUPH_STATUS
336,337,"Ayazaağa Mahallesi Şehit İlhan Yurt Sokak'ta, gece saatlerinde bir apartmanda silah sesi duyan vatandaşlar, binanın girişinde hareketsiz yatan genci gördü. Olay yerine polis ve sağlık ekipleri sevk edildi. Silahla [PET_BOUNDARY]göğsünden[PET_BOUNDARY] vurulduğu belirlenen 17 yaşındaki D.Ş, kaldırıldığı Maslak Acıbadem Hastanesi'nde müdahaleye rağmen kurtarılamadı. Olayla ilgili 2 kişinin ifadesine başvuruldu. Soruşturma sürdürülüyor.",göğüs,0,sometimes_euph
2161,2162,Sanıldı - Son Dakika Dünya Acill 18 sayfa gazeteyi tek tuşla nasıl baskı alabirim!!! Arkadaşlar Bayram öncesi iyice [PET_BOUNDARY]sıkıştım[PET_BOUNDARY]. :sadsmile: Acil yardımınıza ihtiyacım var. Mac Quark 7.0'de çalışma geldi bilgisayarıma. 18 sayfalı bir dosya.,sıkışmak,0,sometimes_euph
793,794,Pandayı bulan veterinerler hastalığı teşhis etmek için hayvana narkoz verme kararı aldı. Ancak klinikteki narkoz makinesi küçük kalınca 5 litrelik bir su şişesi maskeye dönüştürüldü ve dev panda bu sayede [PET_BOUNDARY]uyutuldu[PET_BOUNDARY]. Karantinada tutulan pandanın tedavisi devam ediyor. Etiketler: Çin,uyutmak,0,sometimes_euph
2078,2079,daha elzem görülmektedir. Ama vakit darlığı yoksa kişinin de tuvalet ihtiyacı varsa abdestli olsa bile ilk önce [PET_BOUNDARY]ihtiyacını görüp[PET_BOUNDARY] tekrar abdest alıp namazını huşu içinde kılması en doğrusudur. Bu durum namaz kılan kişinin hem fiziksel,ihtiyacını görmek,1,sometimes_euph
452,453,"DENİZLİ (AA)  -  Eski milli futbolcu Rıdvan Dilmen'in annesi Makbule Dilmen, Denizli'de tedavi gördüğü hastanede hayatını kaybetti. Denizli'de Özel Odak Tıp Merkezinde 17 Aralık'tan beri solunum yetmezliği nedeniyle tedavi gören Makbule Dilmen, 80 yaşında [PET_BOUNDARY]hayata gözlerini yumdu[PET_BOUNDARY]. Makbule Dilmen'in cenazesinin, yarın Aydın'ın Nazilli ilçesinde toprağa verilmesi bekleniyor. Etiketler: Rıdvan Dilmen , Denizli , Nazilli , Aydın , Denizli Haberleri « önceki haber sonraki haber »",hayata gözlerini yummak,1,always_euph
1145,1146,"en üst kısmından gelir. Sağlıklı olan ve buluğ çağına giren her kadından belli zamanlarda akar. Sana kadınların [PET_BOUNDARY]aybaşı[PET_BOUNDARY] hali hakkında soruyorlar.-De ki: (O (hâl) bir eziyettir'. Kadınlar aybaşı halindeyken onlara yaklaşmayın,",aybaşı,1,sometimes_euph
653,654,"Genelkurmay Başkanlığı'nın internet sitesindeki bölücü terör örgütüyle mücadeleye ilişkin duyuruya göre, Tunceli'nin Çemişgezek ilçesi Tekeli köyü bölgesinde bölücü terör örgütü mensuplarınca araziye döşenmiş, üçer kilogram amonyum nitrat kullanılarak hazırlanmış uzaktan kumandalı iki el yapımı patlayıcı [PET_BOUNDARY]madde[PET_BOUNDARY] bulundu.",madde,0,sometimes_euph
1277,1278,"diğer adı ile küretaj kadınlarda hamileliğin sonlandırılması operasyonuna verilen isimdir. Halk arasında sadece [PET_BOUNDARY]hamileliğin sonlandırılması[PET_BOUNDARY] işlemi olarak bilinen kürtaj, düşük sonrası rahim içinin temizlenmesi, rahmi gebeliğe hazırlamak gibi amaçlar için",hamileliği sonlandırmak,0,sometimes_euph
1021,1022,"589418        Köy köy dolaşarak hikâyeler biriktiren; romanların, denemelerin, şiirlerin sahibi, eserleri birçok dile çevrilmiş Yaşar Kemal, bugün ardında bıraktığı binlerce kelime ile [PET_BOUNDARY]aramızdan ayrıldı[PET_BOUNDARY].",aramızdan ayrıldı,1,sometimes_euph
1471,1472,"bir sınav mı yoksa deneyim mi olacak ? İkis... Kadınların Özel Günlerinde Bakım Yapmasının Hükmü Soru: Bayanların [PET_BOUNDARY]muayyen günlerinde[PET_BOUNDARY], saç tırnak kesimi, saç boyama vs... kişisel bakımlarını yapmaları sakıncalı mıdır? el Cevab: Saydığınız amellerin",muayyen günü,1,sometimes_euph
1153,1154,"başlamaz. Ve her iki cinste de 18 yaşından sonraya ergenlik kalmaz. Yani 18 yaşına geldiğinde bir kız çocuğu hâlâ [PET_BOUNDARY]aybaşı[PET_BOUNDARY] görmemişse, bir erkek çocuğu hâlâ ihtilam olmamışsa bir doktora görünmeleri tavsiye edilir ve bu yaştan sonra bu",aybaşı,1,sometimes_euph
567,568,"11. Cumhurbaşkanı Abdullah Gül, Ankara'daki terör saldırısı için Twitter hesabı üzerinden bir açıklama yaptı. ""Ankara'daki hain terör saldırısını lanetliyorum. Aziz milletimize başsağlığı diliyorum"" diyen Gül, ""Hayatını [PET_BOUNDARY]kaybedenlere[PET_BOUNDARY] Allah'tan rahmet, yakınlarına başsağlığı ve yaralılara acil şifalar diliyorum"" ifadelerini kullandı ve 'birarada durma' çağrısı yaptı. Gül, ""Görüşü ve düşüncesi ne olursa olsun, herkesi teröre karşı tavizsiz bir şekilde birarada durmaya davet ediyorum"" dedi.",kaybetmek,1,sometimes_euph
1310,1311,"değildir: ""kökünden kazınması... ""; ""Halk Partisi uru bu vatanın ciğerinden nasıl sökülebilir? ""; ""muhalefetteki [PET_BOUNDARY]iki canlı[PET_BOUNDARY] partinin (AP ve MHP) bütün canlarını tek mihrakta toplayıp CHP üzerine bir ölüm ışığı yöneltmek ve onun sahte canını",iki canlı,0,sometimes_euph
330,331,"Vodafone Arena ile beraber yeni sezona daha güçlü planları içinde olan Beşiktaş, forma sponsorunu da değiştirecek. Geride kalan sezonda formanın [PET_BOUNDARY]göğüs[PET_BOUNDARY] reklamında Toyota yer alıyordu. Yeni sezonda ise siyah - beyazlıların ana sponsoru olan Vodafone reklamı formada yer alacak. Beşiktaş’ın bu doğrultuda yeni forması da sosyal medyaya sızdı. Klasik çubuklu formanın farklı dizaynı göze çarpmakta. İşte Beşiktaş'ın yeni sezonda giyeceği iddia edilen o forma: (Eurosport)",göğüs,0,sometimes_euph
1630,1631,"da üç ay önce geçirdiği trafik kazası sonrası beyni hasar gördüğü için yaşamını makineye bağlı sürdüren genç, [PET_BOUNDARY]fişi çekilecekken[PET_BOUNDARY] kendine geldi. ABD'nin Arizona Eyaleti'ndeki Tucson kentinde geçirdiği trafik kazası sonucunda beyni hasar gören",fiş çekmek,1,sometimes_euph
1014,1015,"189376        Bu düşüncelerimle Ulu Önderimiz Mustafa Kemal Atatürk’ün [PET_BOUNDARY]aramızdan ayrılışının[PET_BOUNDARY] 77. yılında, Türk Ulusunun gönlünde ölümsüzleşen Atamızı bir kez daha saygı, minnet ve şükranla anıyorum.",aramızdan ayrıldı,1,sometimes_euph
434,435,"Atlas Okyanusu'nda 1912 yılında batan Titanic gemisinin hayattaki son kazazedesi Millvina Dean 97 yaşında [PET_BOUNDARY]hayata gözlerini yumdu[PET_BOUNDARY]. Titanic International Society'den yapılan açıklamada, kaza sırasında 2 aylık olan Dean'ın İngiltere'nin Hampshire kentindeki bakım evinde öldüğü bildirildi. Titanic, 14 Nisan 1912 tarihinde buz dağına çarpmasının ardından kısa süre içinde batmıştı. Dean, annesi ve erkek kardeşiyle birlikte kurtulanlar arasında yer alıyordu.",hayata gözlerini yummak,1,always_euph
1317,1318,"935 bin 850 TL olacak. Gebelikte 'iki kişilik' beslenmeyin Hamilelik döneminde halk arasında söylendiği gibi ""[PET_BOUNDARY]İki canlısın[PET_BOUNDARY] , daha fazla beslen ya da iki kişilik beslen"" gibi söylemlerin yanlış olduğu bildirildi. Sağlık 17 Mart 2013 Pazar 17:",iki canlı,1,sometimes_euph
962,963,"414535	Geçtiğimiz günlerde verdiği bir konserinde dikkat çekici [PET_BOUNDARY]göğüsleriyle[PET_BOUNDARY] ilgi odağı haline gelen 72 yaşındaki Ajda Pekkan’ın, göğüslerindeki silikon protezleri değiştirttiği konuşuluyor.",göğüs,1,sometimes_euph
1920,1921,"işler arasındadır. Bir başka örnek, 1800'lerin sonlarında New Orleans'ta yaşayan ve hayatı boyunca gizlediği [PET_BOUNDARY]seks işçisi[PET_BOUNDARY] portreleri ölümünden sonra ortaya çıkarılan Ernest J. Bellocq'tur. Hayattayken endüstriyel fotoğrafçı olarak",seks işçisi,1,always_euph
1174,1175,4-5. haftasında görülüyormuş. Biz 6. haftada gördük nedenide geç döllenmeymiş. Zaten biz adete 4 gün kala eşimle [PET_BOUNDARY]birlikte olmuştuk[PET_BOUNDARY] büyük ihtimalle yumurtlamamda bu zamana denk geldi. Bu dönemde döllenme olduğu için haliyle keseyi geç gördük.,birlikte olmak,1,sometimes_euph
1738,1739,"gördüğünü iddia ederek oyaladığını belirterek, şu ifadeyi verdi: ""Süleyman'ın define işleri uğraştığını, ayrıca '[PET_BOUNDARY]üç harfli[PET_BOUNDARY]' olarak tabir ettiğimiz cinler ile irtibatlı olduğunu sık sık kızım Esra bana söylerdi. Ayrıca bu durumu Ecem de",üç harfli,1,sometimes_euph
2129,2130,sektörü ilgilendiren diğer yaptırımlarda olduğu gibi sistemik riske de yaklaşımı 'bekle ve gör' veya daha tepeden [PET_BOUNDARY]inme[PET_BOUNDARY] bir sermaye düzenlemesinden ziyade bütün paydaşları çözüme dahil eden bir yapıda olacaktır ve düzenlemeye ilişkin,inme,0,sometimes_euph
1573,1574,"şekilde yeniden yaratılacaklardır. Derecesi yüksek olanlara verilecek imkânlar daha mükemmel olacaktır. 2. Orada [PET_BOUNDARY]abdest bozma[PET_BOUNDARY], tükürme, sümkürme gibi haller bulunmayacaktır. 3. Hem kendileri mis kokulu olacaklar hem de kendilerine en güzel",abdest bozmak,1,sometimes_euph
1562,1563,"ayak yolundan gelmişseniz yahut kadınlara yaklaşmışsanız ve su bulamamışsanız temiz bir toprağa teyemmüm edin,"" [PET_BOUNDARY]Abdesti bozan[PET_BOUNDARY] şeyler nelerdir ? Ayrıca ayette (veya ayak yolundan gelmişseniz ... teyemmüm edin) diyor. Bu durumda her ayak",abdest bozmak,0,sometimes_euph
1663,1664,"gibi sanıp sonra gerçekle yüzleşen insanlar genelde ""güven problemim oluştu"" diyorlar problem yok aslında, önceden [PET_BOUNDARY]safmış[PET_BOUNDARY], akıllanmış Bir insan ihanete uğradığında öncelik olarak karşısındakine olan güveni değil kendisine olan güveni",saf,1,sometimes_euph
806,807,Radikal.com.tr  -  Muğla'nın Bodrum ilçesinde geçirdiği rahatsızlık sonucu tedavisi Maslak Acıbadem Hastanesi'nde yoğun bakım ünitesinde [PET_BOUNDARY]uyutularak[PET_BOUNDARY] devam eden sanatçı Nejat İşler'e Fenerbahçeli futbolculardan da destek geldi. Fenerbahçe'nin resmi Twitter hesabından paylaşılan fotoğrafta 12 numaralı Nejat İşler forması Fenerbahçeli futbolcular tarafından imzalandığı görülüyor. Fotoğrafın altına da: 'Forman hazır! Kalk artık' notu düşülmüş.,uyutmak,0,sometimes_euph
775,776,"Sosyal medya kullanıcıları, 'Hacksaw Ridge' filmiyle 'En İyi Yönetmen' ödülüne aday olan Mel Gibson'ın adaylığına, eşine şiddet uyguladığı yönündeki iddiaların yanı sıra Hispanikler, [PET_BOUNDARY]siyahiler[PET_BOUNDARY] ve Yahudiler hakkında ırkçı açıklamaları nedeniyle karşı çıktı. Sosyal medyada hedef tahtasına konulan diğer ünlü ise 'En İyi Erkek Oyuncu' ödülüne aday gösterilen Casey Affleck oldu. Affleck, daha önce 2 kadın tarafından tacizle suçlanmıştı. (Habertürk)",siyahi,1,sometimes_euph
1830,1831,yüceldin Dedi bana sorma biraz geç kaldın Dedim yaşlanmışsın ne tez kocaldın Dedi vade yetti duymadım eyvah. Dedim [PET_BOUNDARY]son yolculuk[PET_BOUNDARY] kabir yoludur Dedi senin yolun günah doludur Dedim sen bilmezsin Allah kuludur Dedi Hüseyine duymadım eyvah. Hüseyin,son yolculuk,1,sometimes_euph
2196,2197,"oniki yaşına gelince de Firdevsi evermiş-ler. O çocuk! Ne imiş evlilik? Ne bilsin. Böylece,beş yıl kuzu-kuzu beraber [PET_BOUNDARY]yatmışlar[PET_BOUNDARY] onlar. Bir-gün beyi,Hasan Bey,Askere çağrılmış,Çanakkalede Seferberlik İlan edilmiş çünkü. Gitmiş Hasan Bey,",yatmak,0,sometimes_euph
950,951,250400        Bu süreçte çocuklarınız varsa onlarla iletişiminiz muhteşem hale gelecek ve bebek [PET_BOUNDARY]bekleyen[PET_BOUNDARY] balıklar yılın ilk yarısında çocuk sahibi olacaklarını öğrenecekler.,beklemek,1,sometimes_euph
777,778,"İtalyan La Repubblica gazetesinde yer alan habere göre, aşırı yaşlılıktan artık hiç hareket edemez hale gelen 3,5 yaşındaki Heidi, daha fazla acı çekmesini istemeyen bakıcıları tarafından [PET_BOUNDARY]uyutuldu[PET_BOUNDARY]. İnternetteki bir sosyal paylaşım sitesinde görüntülerinin yayımlanmasının ardında bir dünya yıldızına dönüşen sevimli hayvan, oyuncaklara ilham vermiş, hatta Oscar töreninin ""şeref konuğu"" olmuştu.",uyutmak,1,sometimes_euph
1474,1475,ilkâ olundu. Artık Nur dağındaki Hira mağarasının içinde halvete çekilip orada ehlinin yanına gelinceye kadar adedi [PET_BOUNDARY]muayyen günlerde[PET_BOUNDARY] ibadet ederlerdi. O günler için yanlarına azık da alırlardı. Sonra Hz. Hatîce'nin yanına dönüp bir o kadar zaman için,muayyen günü,0,sometimes_euph
1309,1310,"biri kırmızı rujlu bir makyaj yapmak. Kırmızıların tonu tutmayacağı gibi, karşıdan bakıldığından göz algısından da [PET_BOUNDARY]iki canlı[PET_BOUNDARY] kırmızı rahatsızlık yaratacaktır. Göz makyajında, kahve tonları, bronzlar ya da hafif bir siyah dumanlı makyajla,",iki canlı,0,sometimes_euph
79,80,"Fenerbahçe Kulübü, Moussa Sow transfer için Dubai takımlarından Al Ahli ile görüşmelere başladığını KAP’a bildirdi! Senegalli futbolcunun 15 milyon euro bedelle satılması [PET_BOUNDARY]bekleniyor[PET_BOUNDARY]. ""Futbolcumuz Moussa Sow’un transferi konusunda Al Ahli FC kulübü (Dubai) ile görüşmelere başlanmıştır.""",beklemek,0,sometimes_euph
851,852,"Atletizm Federasyonundan yapılan açıklamada, ""Elvan’ın uzun süredir tedavi gören babası Mergia Abeylegesse’nin Etiyopya’da [PET_BOUNDARY]vefat ettiğini[PET_BOUNDARY] üzüntüyle öğrenmiş bulunmaktayız. Merhumun ailesine başsağlığı ve metanet diliyoruz."" denildi. Mergia Abeylegesse’nin cenazesinin bugün Etiyopya’da toprağa verileceği bildirildi.",vefat etmek,1,always_euph
1168,1169,"babası olmakla suçlanıyor. Dedikodu basınına göre 3 ay önce doğum yapan Mariah Yeater, Justin'le bir konser öncesi [PET_BOUNDARY]birlikte olmuş[PET_BOUNDARY] . Justin'e açtığı babalık davasıyla finansal destek talebinde bulunuyor. Justin'in basın sözcüsü ise oldukça sert",birlikte olmak,1,sometimes_euph
1717,1718,"kalan dünya gönlümüzde gittikçe yalanlaşıyor. Hele de ülküdaşlık hukukuyla muhabbet hizasında buluştuklarımız [PET_BOUNDARY]aramızdan ayrılınca[PET_BOUNDARY]... Bu satırların kaleme alınışından bir ay önce 28 Mayıs 2019'da öznesi Türk, nesnesi insanlık olan bir nizamın",aramızdan ayrıldı,0,sometimes_euph
248,249,"Yunan devlet televizyonun konşan Rum bakan, ""Hiçbir şey değişmemişken onay veremeyiz. Müzakere başlıklarının açılmasına izin vermeyiz"" dedi. Türkiye'nin limanlarını ve havaalanlarını kendi gemileri ve uçaklarına açmasını isteyen Rumlar, 23 ve 24 numaralı fasılların müzakerelere açılmasını [PET_BOUNDARY]engelliyor[PET_BOUNDARY].",engelli,0,sometimes_euph
721,722,"BDP Eş Genel Başkanı Selahattin Demirtaş, twitter de yazdığı mesajda, dün Federal Kürdistan Bölgesi'nin Süleymaniye kentinde YNK yetkilileri ile görüştüğünü söyledi. Bugün İstanbul'a döndüğünü ifade eden Demirtaş, ""Dün Süleymaniye'de YNK yetkilileri ile görüştük. Bugün döndük. Ama İstanbul'da valizim gizli bir şekilde aranmış olarak bana teslim edildi. Valizimde her ne aramışlarsa bilmiyorum ama 'barış' valizden çıkmaz. Bunu bilmeyecek kadar [PET_BOUNDARY]saf[PET_BOUNDARY] olmalılar"" dedi.",saf,1,sometimes_euph
2236,2237,". Pek dindar olmayan babamız yorgun olduğunda ona manastır kuşu diyerek alay eder, rahibelerini de al git yat, derdi. [PET_BOUNDARY]Cici anne[PET_BOUNDARY], rahibelere hayrandı. Evimize sık sık rahibeler gelirdi. Cici anne onları misafir ederken salondaki küçük bronz",cici anne,1,sometimes_euph
1629,1630,"dünyada çekmese, öldükten sonra belki bin misliyle ödeyecek. Bu arada şayet hasta kendinde değil de, yakınları [PET_BOUNDARY]fişini çekmeye[PET_BOUNDARY] kalkışıyorsa bilinçsize bir işe girişiyorlar diye düşünüyorum. Doktorlara gelince, onlar tek yönlü düşündükleri",fiş çekmek,1,sometimes_euph
536,537,Hakkari'nin Çukurca ilçesinde polis noktasına uzun namlulu silahlarla ateş açıldı. Saldrıda can [PET_BOUNDARY]kaybı[PET_BOUNDARY] yaşanmadı. Hakkari'nin Çukurca ilçesi girişindeki polis kontrol naktasına akşam saatlerinde PKK'liler tarafından uzun namlulu silahlarla ateş açıldı. Nöbet tutan polislerin de anında karşılık vermesi üzerine çatışma çıktı. Saldırıda can kaybı yaşanmadı.,kaybetmek,1,sometimes_euph
1093,1094,"bu sefer. Serinlik ve sessizlik... Ah şu ses bir sussa daha güzel olacak da. Masada akşamdan kalan fındık poşeti. [PET_BOUNDARY]Fındık kırmak[PET_BOUNDARY] rahatlatır mıydı acaba? Hem de gece gece... Biraz denedim, ne çok sesi çıkıyor bunun da. Komşular ne der sonra. Onu da",fındık kırmak,0,sometimes_euph
1469,1470,". -Klamidya : Cinsel ilişkiden, 7-21 gün sonra ortaya çıkar. Kadınlarda, vajinal akıntı, idrar yaparken ağrı, [PET_BOUNDARY]muayyen günlerin[PET_BOUNDARY] dışında vajinal kanama, karın alt bölümünde ağrı, ateş ve bulantı; erkeklerde ise penisten beyaz su gibi bir akıntı",muayyen günü,1,sometimes_euph
1223,1224,"olmasın çocuk diyecek kadar inceydi. Türkiye'nin yollarının çoğunda emeği olduğu halde, biz tanıyanlar da [PET_BOUNDARY]dört kolluya[PET_BOUNDARY] binince, kimse hatırlamayacak Halil Efendi'yi. Tarihe geçmeyecek. Hakkında araştırmalar yapılmayacak. Çok çok,",dört kollu,1,sometimes_euph
844,845,"Müge Anlı ile Tatlı Sert' programının konuğu Belçika'da yaşayan Peter Heinzl'dı. Elindeki bilgileri canlı yayında paylaşan Heinzl, ""Bana babamı bulun"" dedi. Müge Anlı ve ekibi, Belçikalı Peter'ın babasının iki yıl önce [PET_BOUNDARY]vefat ettiğini[PET_BOUNDARY] ortaya çıkardı. Anlı, Peter ile amcasını stüdyoda buluşturdu. Peter Heinzl, Müge Anlı ve ekibine teşekkür ederek, babasının bu kadar kısa sürede bulunmasına inanamadı.",vefat etmek,1,always_euph
748,749,"İBRAHİM ÇOBAN DHA Acar, Obama’ya benzerliğini seçim kampanyasında kullanıp, ""Akalan’ın Obaması geliyor"" yazılı afiş ve broşür bastırdı. Bunları evlere ve kahvehanelere dağıtarak seçmenlerden oy isteyen Acar, ""Ben [PET_BOUNDARY]siyahi[PET_BOUNDARY] değilim ama esmer olduğum için çok benzetiyorlar"" diyor. Etiketler: ABD",siyahi,1,sometimes_euph
1249,1250,"tuvalette birlikte mahsur kaldıkları ortaya çıktı. O da sanki tesadüf olmasa gerek. Evde tek tuvalet var, onca insan [PET_BOUNDARY]hacet görecek[PET_BOUNDARY], göremiyorlar. Eee sadete gel, dediğinizi duyar gibiyim. Bunlar orada konuşmaya devam etmek istemişler gözlerden",hacet görmek,1,sometimes_euph
1544,1545,"yıkayın. Eğer cünüp iseniz iyice yıkanarak temizlenin. Hasta olursanız veya seferde bulunursanız veya biriniz [PET_BOUNDARY]abdest bozmaktan[PET_BOUNDARY] (def-i hacetten) gelir veya kadınlara dokunur (cinsel ilişkide bulunur) da su bulamazsanız, o zaman temiz bir",abdest bozmak,1,sometimes_euph
1645,1646,"in MİT'in bilmemesi mümkün değil. Tam bir becerisizlik, aymazlık ve art niyet olarak görüyorum. Bunu bilmemek için ya çok [PET_BOUNDARY]saf[PET_BOUNDARY] olunması ya da çok cahil olunması lazım. Ben şahsen saflık veya cehalet olduğunu düşünmüyorum işin içinde hükümetin",saf,1,sometimes_euph
972,973,"647516	Murat Emiroğlu, göğüs proteziyle kanser arasında herhangi bir ilişki bulunmadığını belirterek, ""Silikon protezli bir [PET_BOUNDARY]göğüste[PET_BOUNDARY] kanser gelişmesi riski artmaz, normal göğüs dokusuyla aynıdır"" dedi.",göğüs,1,sometimes_euph
500,501,"IHA Haberin diğer fotoğrafları için tıklayın Gebze Belediyesi Kurban Bayramı öncesinde [PET_BOUNDARY]ihtiyaç sahiplerine[PET_BOUNDARY] kıyafet yardımında bulundu. Gebze Belediyesi Sosyal Yardım İşleri Müdürlüğü tarafından yaklaşan Kurban Bayramı öncesi ihtiyaç sahibi ailelere kıyafet yardımında bulundu. Gebze Belediyesi tarafından başlatılan çalışma kapsamında, yetişkin ve çocuklar için yapılan kıyafet yardımından Gebze genelinde 260 aile faydalandı. Etiketler: Gebze , Kocaeli Haberleri « önceki haber sonraki haber »",ihtiyaç sahibi,1,sometimes_euph
362,363,"Ankara Çankaya'da Şehit Mustafa Doğan Caddesi'nde başlatılan kaldırım bakım onarım çalışmasında [PET_BOUNDARY]görme engellilerin[PET_BOUNDARY] ulaşımlarını sağlayabilmeleri için hazırlanan şeritlerden kullanıldı. Ancak şeritlerin görme engelli yurttaşları bir yere ulaştırmadığı aksine desen olarak kullanıldığı görüldü. Kaldırıma dik döşenen şeritler Ankaralıların tepkisini toplarken, Belediyeye ve Belediye Başkanı Melih Gökçek'e tepki yağdı.",görme engelli,1,always_euph
1440,1441,". Evet Fiorentinalı olarak normalden fazla tepki gösteriyorum ama olmadı böyle, güzelim maç İspanya Ligi'ne [PET_BOUNDARY]kurban gitti[PET_BOUNDARY]. Tek avuntumuz PSG - Marsilya maçını kaçırmayacak olmamız. Eskişehirspor 1-2 Bursaspor 15' Emre Toraman (k.k.) 37'",kurban gitmek,0,sometimes_euph
944,945,371366        Enfeksiyonun kişiden kişiye bulaşması başlıca korunmasız cinsel temas ve damar içi [PET_BOUNDARY]madde[PET_BOUNDARY] kullanımı sırasında ortak enjektör kullanımıyla olmaktadır.,madde,1,sometimes_euph
285,286,"""cok  kilolu diyorlar ama ilk 25 - 30 metre deparda ronaldo gibi süratli  bir futbolcu cok nadir rekormuş Ronaldo o belle, o göbekle rekor  değil, anca [PET_BOUNDARY]fındık kırar[PET_BOUNDARY].""",fındık kırmak,0,sometimes_euph
1701,1702,", bacakları karna doğru itip çekme hareketleri, bacakları büküp hafif karna doğru bastırmak çoğu zaman en azından [PET_BOUNDARY]gaz çıkartmayı[PET_BOUNDARY] sağlar. Çocuklarda ise hareket etmek, bağırsak hareketliliğinin devamı açısından önemli. Ev dışındaki",gaz çıkarmak,1,sometimes_euph
1574,1575,"pek ilgilenmem ama doğal güzelliklerimizide görmemiz gerekiyo.... Yorum yap Şafilerde kan aktığında [PET_BOUNDARY]abdest bozulmaz[PET_BOUNDARY], Hanefilerde ise abdest bozulur; bunun nedeni nedir. Cevap ARABA YAN CAM PERDE GÜNEŞLİĞİ (2 ADET) için satıcı",abdest bozmak,0,sometimes_euph
1086,1087,", kadrolu ve sezonluk olmak üzere bin 200 çalışanı ile kapsamlı ve yapılandırılmış bir ağ olarak faaliyet gösteriyor. [PET_BOUNDARY]Fındık kırma[PET_BOUNDARY], seçme ve işleme açısından üretim kapasitesi oldukça yüksek ve önümüzdeki yıllarda şirketin büyümesini",fındık kırmak,0,sometimes_euph
1248,1249,"çocukluğumda ""tuvalet"" sözcüğü pek bilinmezdi. Tuvalet, zengin kadınların balolarda giydikleri giysinin adıydı. [PET_BOUNDARY]Hacet görülen[PET_BOUNDARY] o yere ""ayakyolu, memişhane, kenef, kademhane, apteshane"" gibi pek çok ad verilirdi ya da düpedüz ""hela"" denirdi. """,hacet görmek,1,sometimes_euph
2293,2294,"dışarıya gitti. 42' Rakip yarı alandan serbest vuruş kullandık. Ceza alanına yapılan ortada Selçuk, topu kafasıyla [PET_BOUNDARY]aşırdı[PET_BOUNDARY] ama araya giren savunma topu kornere gönderdi. 40' Sağ kanattan gelişen Juventus atağında Vidal'in ceza alanına",aşırmak,0,sometimes_euph
1554,1555,"ve gölge. Buralarda abdest bozmayın. "" [4] g) Durgun veya akar suda abdest bozmamalı, bir özür bulunmadıkça ayakta [PET_BOUNDARY]abdest bozmaktan[PET_BOUNDARY] sakınmalıdır. Bütün bunlar mekruhtur. h) Abdest bozduktan sonra temizlik sol el ile yapılmalı ve tuvaletten çıkınca",abdest bozmak,1,sometimes_euph
373,374,"""İmza, Serdengeçti ... Merhum Dr. İbrahim Sadullah Nutku'yu, güzellikleri aksettiren bir ayna olarak , yine kendisi gibi [PET_BOUNDARY]Hakk'ın rahmetine kavuşmuş[PET_BOUNDARY] O. Y. Serdengeçti'nin bir yazısı  ile takdim etmek istedim.""",hakkın rahmetine kavuşmak,1,always_euph
768,769,"Şükrü Saracoğlu'nda olayların yaşandığı derbi maçın ardından Drogba ve Eboue'ye gösterilen muz iddialarının ardından olayın kahramanlarından bir taraftar şu açıklamalarda bulundu. ""Bir operasyon geçirdim. O yüzden genelde meyveyle besleniyorum. Tam meyveyi yerken tezahüratlar başladı elimde meyve olduğu için onu salladım. Benim [PET_BOUNDARY]siyahi[PET_BOUNDARY] arkadaşım var. Böyle bir şey yapmam mümkün değil"" İŞTE O ÇOK KONUŞULAN AÇIKLAMA",siyahi,1,sometimes_euph
764,765,"ABD'de 48 saat içinde iki [PET_BOUNDARY]siyahi[PET_BOUNDARY], polis tarafından vurularak öldürüldü. Salı gecesi Louisiana Eyaleti'nde bir siyahinin vurulmasının ardından çarşamba gecesi de Minnesota Eyaleti'nde 32 yaşındaki siyahi bir genç polis tarafından vuruldu. Gencin trafik kontrolü esnasında araçta bulunan kız arkadaşının gözleri önünde vurulduğu belirtildi. Siyahi genç hastanede hayatını kaybetti. Eyalet polisi tarafından yapılan açıklamada polis memurunun zorunlu izne çıkarıldığı bildirildi. © Deutsche Welle Türkçe",siyahi,1,sometimes_euph
801,802,"Çocuklarının bir dadıya ihtiyacı olmadığını söyleyen şarkıcı ""Çocuk - larımın hiçbir anını kaçırmak istemiyorum. Onları [PET_BOUNDARY]uyutan[PET_BOUNDARY], banyolarını yaptıran benim"" diyor. Kendisinin bir asistanı olduğunu söyleyen Martin, ""Ben oğullarımla ilgilenirken, asistanım da bana yardımcı oluyor"" dedi. Etiketler: ""Çocuk - larımın , İkizleriyle , ilk ,",uyutmak,0,sometimes_euph
2413,2414,"oldukları beyan ve söze uydukları esas alınır. Bunun aksi görüldüğü takdirde Yediler Konseyi kararıyla sistemden [PET_BOUNDARY]çıkarılırlar[PET_BOUNDARY]. Ekonomik devamlılığını nasıl sağlıyor? Türetici ve üreticilerin bireysel ve kurumsal desteklerinin yanı sıra,",çıkarmak,1,sometimes_euph
