,ID,TEXT,PET,LABEL,EUPH_STATUS
314,315,Menopoz öncesinde bazı belirtiler yaşanır ve bunlar vücudun alarm sinyalleridir. İşte menopozun bilmeniz gereken belirtileri... Sıcak basması Duygusal değişimler [PET_BOUNDARY]Göğüs[PET_BOUNDARY] ağrısı Hamile kalmada sorun yaşama Kilo değişimleri Libidonun düşmesi Düzensiz adet görme Vajinal kuruluk Eklem ağrıları İdrar yolu enfeksiyonları,göğüs,1,sometimes_euph
1294,1295,". Hamilelikte fark edilen kalıtsal bir hastalık, anne ve babaya bildirilir. Bunun akabinde, belki de anne-baba [PET_BOUNDARY]hamileliği sonlandırma[PET_BOUNDARY] kararı alırlar. Onun için en doğru kararın verilmesi çok önemli. Sonuçta her ne olursa olsun, rahme düşmüş her",hamileliği sonlandırmak,1,sometimes_euph
461,462,"IHA Haber - iş Sendikası Şube Başkanı Erol Toprak geçirdiği kalp krizi ile [PET_BOUNDARY]hayata gözlerini yumdu[PET_BOUNDARY]. Haber - İş Sendikası Başkanı Erol Toprak, evinde geçirdiği kalp krizi geçirdi. Tüm müdahalelere rağmen kurtarılamayan Erol Toprak’ın cenazesi yarın öğle namazına müteakip, Tomarza İlçesi, Kapukaya Köyü’nden defnedilecek. Etiketler: haber , Kayseri Haberleri « önceki haber sonraki haber »",hayata gözlerini yummak,1,always_euph
2334,2335,"ani rahatsızlık sonucu hayatını kaybetti. Mani... Bölücü terör örgütü PKK'nın saldırı ve tuzakları yüzünden [PET_BOUNDARY]hayata veda edenler[PET_BOUNDARY], yüreğimizi yakıyor. Şehitlerimize Allah'tan rahmet, yakınlarına, milletimize sabır ve başsağlığı diliyorum. Ş.",hayata veda etmek,1,sometimes_euph
2061,2062,". Lüleburgazspor'da başkanlık, yöneticilik ve futbolculuk yapmış bir sürü ağabeyimiz, arkadaşımız vardı. Çoğu [PET_BOUNDARY]öteki dünyaya göç etti[PET_BOUNDARY]. Dünyada terzisine ölçü veren gidiyor, gidecek! Allah'ın emri bu... Hadi hep beraber oyalanalım. Boşanma",öbür dünyaya göçmek,1,always_euph
1200,1201,". Platon, Şölen diyaloğunda, Aristophanes'in ağzından aşkın tarihini şöyle anlatır: ""İnsanlar eskiden iki başlı, [PET_BOUNDARY]dört kollu[PET_BOUNDARY], dört bacaklı, hermafrodit ve çok güçlü yaratıklarmış. Kendi kendilerine yetebildikleri için çok gururlu olan bu",dört kollu,0,sometimes_euph
1262,1263,"etmek İki ayağı topuklara dek bir kere yıkamak. Abdestin bozulmasını gerektiren haller şunlardır: Yemek-içmek, [PET_BOUNDARY]hacet görmek[PET_BOUNDARY] , yellenmek, ağız dolusu kusmak, vücudun bir yerinden kan veya irin boşalması, tükürüğün en az yarısının kan olması,",hacet görmek,1,sometimes_euph
2397,2398,haneler pandemi döneminde tasarruf miktarlarını arttırarak ya da büyük ölçüde zarar görmeden atlatabilse de [PET_BOUNDARY]düşük gelirli[PET_BOUNDARY] hanelerin yaşadığı olumsuzluklar nedeniyle toparlanmanın özellikle ABD'de düzensiz olacağı öngörülüyor.,düşük gelirli,1,sometimes_euph
1609,1610,"olduğunu nereden, biliyorsun? Rus; – Kendisi bana söyledi, dedi, hatta öldürmeyip size götürmemi söyledi. Ben ise, [PET_BOUNDARY]işini bitirdim[PET_BOUNDARY]. Tokta, bu söz üzerine çok kızdı. Böyle büyük şerefli insana saldırarak kendisine teslim etmediği için Rusu öldürttü",işini bitirmek,1,sometimes_euph
388,389,"""Uzun süredir tedavi görmekte olduğu amansız hastalıktan kurtulamayarak [PET_BOUNDARY]hakkın rahmetine kavuşan[PET_BOUNDARY] merhuma  Allah (CC) tan rahmet, yakın akraba ve doslarınabaş sağlığı  dileriz.""",hakkın rahmetine kavuşmak,1,always_euph
1175,1176,"anlatmaya devam ediyordu. //Bu kız çok sağlam pabuç değil,okurken bunu biri kandırmış, okulu bırakıp onunla [PET_BOUNDARY]birlikte olmuş[PET_BOUNDARY], meğer adam evliymiş kızı karnında çocukla ortada bırakmış vs.. Bu gün yarın orta malı olarak piyasaya düşer.şimdiye",birlikte olmak,1,sometimes_euph
483,484,"""TİYATRO AÇIKÇA"" katkıları ile gerçekleştirilecek oyunun geliri ile [PET_BOUNDARY]ihtiyaç sahibi[PET_BOUNDARY] engelli kardeşlerimizin onura edilmesi amaçlanıyor. İstenilen miktarda biletler derneğimiz tarafından adrese teslimat yapılacaktır. Bilet talep: Özlem KIRTAŞ Tel: (216) 370 81 66 (pbx) NOT: Bilet alıp gelmeyenlerin yerine engelli ve engelli aileleri davet edilecektir. Tarih: 19 Aralık cumartesi günü saat:15.30 da",ihtiyaç sahibi,1,sometimes_euph
1527,1528,". Yerlerde ölü koalalar var. Anneleri yavrularıyla öldürdüler. Avustralya utanç duymalı"" dedi. Koalalardan 30'u [PET_BOUNDARY]uyutuldu[PET_BOUNDARY] Cuma günü bölgeye giden ekipler, çok sayıda hayvanın öldürüldüğüne tanık oldu. Muayene edilen 80 hayvandan 30'u",uyutmak,1,sometimes_euph
1835,1836,"önce de ütopik değil bilimsel temellere sahip sonsuz bir devrimci inançla atılmıştır. Engels, Avrupa'ya yaptığı [PET_BOUNDARY]son yolculuk[PET_BOUNDARY] sırasında işçilere seslenirken şunları söylüyordu: ""İçinde bulunduğum 50 yıl süresince hareket için herhangi bir",son yolculuk,0,sometimes_euph
701,702,"BİTLİS AA Şehit Topuz’un Türk bayrağına sarılı [PET_BOUNDARY]naaşı[PET_BOUNDARY], kortejle ilçedeki Ulu Cami önüne getirildi. Şehit Topuz’un tabuta sarılan yakınlarını vatandaşlar ve askeri yetkililer teselli etti. Şehidin polis olan ağabeyi Haluk Topuz da kardeşinin bordo beresini takarak silah arkadaşlarına sarıldı. Tören alanında şehidin tabutunun üzerine bordo beresi ve yanına ise 4 mermi bırakıldı. Şehit Topuz’un naaşı, törenin ardından Abdurrahman Gazi Şehitliği’nde defnedildi. Etiketler:",naaş,1,always_euph
982,983,461052        Hayatının yeni döneminde [PET_BOUNDARY]birlikte olmak[PET_BOUNDARY] istediği kadından beklentileri neler?,birlikte olmak,0,sometimes_euph
1679,1680,içinde ilerlerken kramp veya basınç hissedilebilir. Ağrı pek duyulmaz. İnceleme sırasında gaz kaçırma hissi veya [PET_BOUNDARY]gaz çıkartma[PET_BOUNDARY] normaldir. Bu nedenle utanılmaması gerekir. İnceleme sonrası kramplar devam ediyorsa biraz yürümek yararlıdır.,gaz çıkarmak,1,sometimes_euph
2143,2144,"sürdürüyordu. Ayşegül yanına yaklaşıp sordu : - Neyin var Eray ? İyi görünmüyorsun. - Tuvalete gitmeliyim ! Çok [PET_BOUNDARY]sıkıştım[PET_BOUNDARY]! dedi Eray. - Gitsene o zaman, neden bekliyorsun ? - Bu hakkımı teneffüste kullanmak istemiyorum da ! Süper Teyze 92",sıkışmak,1,sometimes_euph
2211,2212,"Nuriyi buradan alıp evine götürdüklerinde ""La ilahe illallah"" demesi telkin edildi. ""Zaten Ona gidiyoruz ya"", deyip [PET_BOUNDARY]canını teslim etti[PET_BOUNDARY]. *** Allah'ın selamı üzerlerine olsun Allah göğsünüzü, içinizi ısıtsın sımsıcak yapsın inşaallah kardeşlerim ***",canını teslim etmek,1,sometimes_euph
2278,2279,"sevgilisini katı kalpli, hissiz ve merhametsiz olarak tanımlamıştır. Yazar romanında bir kişiyi betimlerken ""[PET_BOUNDARY]eli uzun[PET_BOUNDARY] biridir"" demişse, aslında kişinin elinin büyük ve uzun olduğunu anlatmak istememiştir. Asıl anlatmak istediği",eli uzun,0,sometimes_euph
1406,1407,özel bir duo performansı imiş. İlginç olan kayıtlar yapılmasına rağmen daha önce yayınlanmaması. Anlaşılan [PET_BOUNDARY]iyi saatte olsunlar[PET_BOUNDARY] devreye girmiş çünkü böyle kayıtlar niye yayınlanmaz doğrusu anlaması zor. Kayıtlar 15 Ocak 1999 günü Kopenhag'da,iyi saatte olsunlar,0,sometimes_euph
841,842,"Emekli astsubay olan ve daha önce felç geçiren Dalyan Ergün, saat 02.00 sıralarında, Yenimahalle'deki evinde [PET_BOUNDARY]vefat etti[PET_BOUNDARY]. Evli ve 2 çocuk babası olan Dalyan Ergün'ün ölüm haberini alınca cenazeye katılmak için İznik'e gelen Halil Ergün, ağabeyinin felç geçirdikten sonra 3 yıldır evden çıkamadığını söyledi.",vefat etmek,1,always_euph
800,801,"SUAT DENİZ Iğdır DHA İnekleri borçlanarak aldığını anlatan çiftçi Bağcı, şöyle konuştu: ""Hırsızlar, gece yarısı tel örgüleri keserek bahçeme girmiş. Köpeklere de ilaç verip [PET_BOUNDARY]uyutmuşlar[PET_BOUNDARY]. Tek geçimim bu ineklerdi. Ne yapacağımı şaşırdım. Bu da yetmez gibi yavrularına her gün 10 kilo süt alıp içiriyorum. Evimin geçim kaynağı olan ineklerimin bulunmasını istiyorum."" Etiketler: Iğdır",uyutmak,0,sometimes_euph
48,49,"""Arketipsel olarak Kırmızı Ayakkabılar'ın [PET_BOUNDARY]aybaşı[PET_BOUNDARY] kanamalarının başlaması ve anne tarafından daha  az korunan bir hayata geçilmesi, genç bir kadına kendisinden büyük kadınlar  tarafından dış dünyanın farkında olma ve ona tepki gösterme yollarının öğretilmesiyle ilgili  çok eski bir öykü ya da mitin üst üste binen parçalarından biri  olması mümkündür.""",aybaşı,1,sometimes_euph
966,967,"468015	Hep bununla ilgili oldu, hiçbir zaman büyük bir film olması ya da “[PET_BOUNDARY]göğüslerimi[PET_BOUNDARY] göstermeliyim” gibi şeylerle alakalı değildi.",göğüs,1,sometimes_euph
2385,2386,"insanlar bu hâlleriyle intihar etmeye başladı. En az 60 kişi intihar etti, binlerce kişi kanser oldu, kalp kriziyle [PET_BOUNDARY]hayatına veda etti[PET_BOUNDARY]. Bunların çoğu yetişkin insanlardı ama OHAL döneminin zulümleri sadece yetişkinleri bulmadı, çocukları da buldu",hayata veda etmek,1,sometimes_euph
633,634,"Çevreci avukat Arif Ali Cangı, 11 ayrı kategoride düzenlenen 'Nüklersiz Gelecek' ödüllerinde 'Avukatlık ve Aktif Ödülleri Afrika'da  ödül almaya hak kazandı. avukat Arif Ali Cangı'ya İzmir'in Gaziemir ilçesi'nde bulunan eski kurşun fabrikası alanında radyoaktif [PET_BOUNDARY]madde[PET_BOUNDARY] gömülmesiyle ilgili yaptığı çalışmaları ve duyarlı çevreci olması nedeniyle ödül verildiği belirtildi. Avukat Arif Ali Cangı, ödülünü Kasım ayının ortalarında Güney Afrika'da  düzenlenecek etkinlikte alacak.",madde,0,sometimes_euph
2392,2393,"genellikle İspanya veya Yunanistan'a yapılan benzer gezilerden daha pahalıdır, bu nedenle Malta'da çok fazla [PET_BOUNDARY]düşük gelirli[PET_BOUNDARY] turist yoktur. 2014 yılında Malta'da toplam 40.222 yatak kapasiteli 149 turizm işletmesi tescil edilmiştir.",düşük gelirli,0,sometimes_euph
294,295,"EKONOMİ SERVİSİ [PET_BOUNDARY]Gelişmekte olan ülke[PET_BOUNDARY]lere ait 50 milyar dolarlık varlık yöneten Franklin Templeton Fonu’nun yöneticisi olan Mark Mobius (77), kötü günlerin henüz geride kalmadığı yorumunda bulundu. Bloomberg’e konuşan Mobius, ""Olumsuz algı hâlâ yerli yerinde. O yüzden daha çok satış bekleyebilirsiniz"" dedi. Öte yandan Harvard Üniversitesi Profesörü Kenneth Rogoff’a göre ise gelişmekte olan ülke piyasaları korkulduğu kadar kırılgan değil. Etiketler: Harvard , Harvard Üniversitesi",gelişmekte olan ülke,1,sometimes_euph
1755,1756,". "" dedi. Kapkara Bir Şey Hareket Etti Herneyse işte; hocadan bir şey demeden çıktık. ""Oğlum benimle ne alakası var? [PET_BOUNDARY]Üç harfli[PET_BOUNDARY] sana aşık olmuş. Ben neden tuhaf sesler duyuyorum? Hem korkuyorum... "" dedim. (Meğerse benim olayım farklıymış. Daha",üç harfli,1,sometimes_euph
1705,1706,"lik skorla kaybetti. Konuyla ilgili konuşan Ljungkvist şöyle konuştu ""Midemde kötü bir ağrı vardı, son dakikada bir [PET_BOUNDARY]gaz çıkardım[PET_BOUNDARY]. Sonrasında hakem bana geldi ve ikinci sarı kartı gösterdi. Garip bir cezaydı, inanamadım. Çok sinirlendim. Sanırım",gaz çıkarmak,1,sometimes_euph
170,171,"DHA Mustafa Ö., genç kızından hoşlandığı için kendisini doktor olarak tanıttığını belirterek, ""Bir kez kendi rızası ile [PET_BOUNDARY]cinsel ilişkiye girdik[PET_BOUNDARY]. Kendi rızası dışında herhangi bir tehdit ya da şantaj yapmadım"" diye savunma yaptı. Etiketler: Adana",cinsel ilişkiye girmek,1,always_euph
510,511,"""Teşekkür ederim  07.07.2006 18:56 tarihinde yazılmış merhaba haldun bey, fotoğrafçı gözüyle görmek bu  işte, birbirlerinden sevgi ve destek alarak şehirin acımasız hayatında hayatta kalmaya  çalışan [PET_BOUNDARY]iki canlı[PET_BOUNDARY], ikiside sevgi dolu, ve bu sevgileri fotoğrafa  yansımış, konusuyla ön plana çıkmış çok anlamlı çalışma, tebrik ederim ... 06.07.2006 10:05 tarihinde yazılmış Mehalat hanım deveninnali fatih serdaroğlu ne denir  ki işte o an.""",iki canlı,0,sometimes_euph
439,440,"Amerikalı ünlü komedyen Garry Shandling Los Angeles ’ta [PET_BOUNDARY]hayata gözlerini yumdu[PET_BOUNDARY]. 67 yaşındaki komedyenin ölüm sebebi henüz bilinmiyor. Mlyonlarca hayranı olan Garry, ünlü komedi dizisi ""The Larry Sanders Show"" ile tanınıyordu. Los Angeles polis Shandling’in kaldırıldığı hastanede hayatını kaybettiğini açıkladı.",hayata gözlerini yummak,1,always_euph
2361,2362,Kemal Kılıçdaroğlu gibi sıfır numara bir siyasetçi tarafından madara edilen bir kişi olarak yakın gelecekte siyasi [PET_BOUNDARY]hayatına veda edecek[PET_BOUNDARY]. Üzülerek yazıyorum ama Sayın Erdoğan bu türden uyarıları dikkate almayıp başının dikine gittiği için bu,hayata veda etmek,0,sometimes_euph
1970,1971,", ama Paul Auster kabul etmemiş. Ailesinin Durumu Ailesinin durumu iyiymiş aslında Paul Auster'ın. Fakat babasının [PET_BOUNDARY]eli sıkıydı[PET_BOUNDARY], annesi ise harcama yapmaktan çekinmezmiş. Aslında annesi har vurup harman savuran biri değilmiş ama babasının",eli sıkı,1,sometimes_euph
1098,1099,"hastanenin 500 araçlık büyük bir otoparkı da bulunuyor. Akşener'e Şok Sözler; Üniversite yıllarını iyi biliriz, çok [PET_BOUNDARY]fındık kırdın[PET_BOUNDARY] . İYİ Parti Genel Başkanı Meral Akşener'in ''Alaattin Çakıcı benim dava arkadaşım falan değildir'' sözlerinin",fındık kırmak,1,sometimes_euph
1897,1898,"bir kere yaşamanız adeta bağımlım olacağınız anlamına geliyor. Benimle beraberlik özeldir ve sektördeki diğer [PET_BOUNDARY]hayat kadınlarından[PET_BOUNDARY] daha seksi olduğumu belirtmem gerekiyor. Erotik dansları, striptiz şovlarını ve ekstra sunumları seviyorum.",hayat kadını,1,always_euph
262,263,"İstanbul Büyükşehir Belediyesi'nin hazırladığı 2015 - 2019 yıllarını kapsayan stratejik planda İstanbul'da köklü dönüşümler hedefleniyor. Tüm otobüs, minibüs ve taksiler [PET_BOUNDARY]engelli[PET_BOUNDARY] kullanımına uygun hale getirilirken minibüslere de İstanbulkartla binilecek. 2019’a kadar minibüs, taksi ve servis araçlarının internet üzerinden ruhsat alması için altyapının tamamlanması planlanıyor. 6 bin 363 minibüs, 393 deniz motoru, 572 taksi engelli kullanımına uygun hale getirilecek.",engelli,1,sometimes_euph
1587,1588,ve tüm sığınma dualarını okuduğu halde bunun nasıl olduğuna bir anlam veremez. Halbuki o bunları yapmıştır ama [PET_BOUNDARY]abdesti bozulduktan[PET_BOUNDARY] sonra tekrar almayı unutmuştur! Önemli: Hasta eğer çok etkili bir sihre maruz kalmışsa ya da kendisi zayıfsa şeytan,abdest bozmak,0,sometimes_euph
2244,2245,"ama ben aradım. 16 Mart'ta Çiçek Bar'da doğum günüme davet ettim. Orada çaktırmadan Memet Ali'ye, oğlum bu hanımı sana [PET_BOUNDARY]cici anne[PET_BOUNDARY] olarak alayım mı diye sordum. 'Olmaz! Önce sen değişmeye hazır mısın onu söyle baba? ' dedi. Ele avuca sığmaz bir",cici anne,1,sometimes_euph
1954,1955,"in, Fazıl Say'ın, benim ve daha nice sanatçının hocası olmuş piyanist Mithat Fenmen hocamızın odası lokantanın [PET_BOUNDARY]tuvaleti yapılmış[PET_BOUNDARY], o güzelim odalar aşağı katlarda mutfak haline çevrilmiş, Türk Beşleri'nden olan ünlü bestecimiz Ulvi Cemal Erkin'",tuvalet yapmak,0,sometimes_euph
2029,2030,"şöyledir; ""Kötü rüya gören kimseye söylemesin, şeytandan da Allahü teâlâya sığınsın. "" (Müslim) ""Rüyasında hoşa [PET_BOUNDARY]gidici[PET_BOUNDARY] güzel şeyler gören, görüşü isabetli salih birine anlatsın! O da hayra yorsun! "" (Beyheki) ""Sözü doğru olanın, sadık",gidici,0,sometimes_euph
1634,1635,"hayata girersem fişimi çek, yaşamak istemiyorum, yaşayamam, bütün Türkiye beni severken, izlemişken, benim [PET_BOUNDARY]fişimi çek[PET_BOUNDARY], bu benim kelamım ne olur' dedim. Abi hiç merak etme dedi, kabullendi üzereydi nerdeyse... Bitkisel hayata girme",fiş çekmek,1,sometimes_euph
570,571,"Altın fiyatları bugün açıklanacak tarım dışı istihdam verilerinin öncesinde dolardaki yükselişle beraber altı haftanın en büyük haftalık [PET_BOUNDARY]kaybını[PET_BOUNDARY] yaşamaya hazırlanıyor. Spot altının ons fiyatı yatay bir seyirle 1,278.70 dolardan işlem görürken, haftalık bazda yüzde 1.2 kayıp gerçekleştirmeye hazırlanıyor. ÇEYREK ALTIN NE KADAR? Kapalıçarşı'da altının gramı 120,60, çeyrek altın 198,56 liradan işlem görüyor.",kaybetmek,0,sometimes_euph
587,588,"Özel İdare İlköğretim Okulunda, birinci sınıf öğrencisi Mehmet Enes Demirabay (6), giriş katında bulunan ve arızalı olduğu belirtilen asansörün kapısını açınca dengesini [PET_BOUNDARY]kaybederek[PET_BOUNDARY] boşluğuna düştü. Haber verilmesi üzerine olay yerine gelen 112 Acil Servis ekiplerince Adıyaman Üniversitesi Eğitim ve Araştırma Hastanesi'ne kaldırılan çocuğun durumunun ciddi olduğu bildirildi. Olayla ilgili soruşturma sürüyor.",kaybetmek,0,sometimes_euph
1975,1976,". Harun ve Cemal zıt karakterde iki kardeştir. Harun ne kadar cömert ve eli açıksa, Balıkçı Cemal de o kadar cimri ve [PET_BOUNDARY]eli sıkıdır[PET_BOUNDARY]. Pintiliğinden doktor olacak oğlu Ali'yi üniversiteye göndermez. Ali kıt kanaat geçinen amcası Harun ve yengesi",eli sıkı,1,sometimes_euph
1888,1889,"Kız İmam Hatip Lisesi Matematik Öğretmenlerinden çok kıymetli Erdal KÜÇÜKNANE Hocamız Covid-19 virüsünden dolayı [PET_BOUNDARY]Hakkın Rahmetine Kavuşmuştur[PET_BOUNDARY]. Allah Rahmet Eylesin Mekanı Cennet Olsun İnşallah... Evrim, kelime anlamı olarak gelişimi, değişimi ve",hakkın rahmetine kavuşmak,1,always_euph
175,176,"İngiltere’de Tressa Middleton adlı kız çocuğu ergenliğe erken ulaştı. Tressa henüz 11 yaşındayken partide sarhoş olup bir delikanlıyla [PET_BOUNDARY]cinsel ilişkiye girdi[PET_BOUNDARY]. Bu ilişkiden hamile kalan Tressa 12 yaşında anne oldu. Tressa ve kızı, sosyal hizmetler kurumuna alındı. Sonra bir aile, bebeği evlat edindi.Şimdi 16 yaşında olan Tressa feryat etti: Doğumdan sonra bunalıma girip alkol ve uyuşturucu kullandım. Kızımı görmem yasaklandı. Tressa ve bebeği Yasak kaldırılsın. Evlat hasreti çekiyorum. POSTA",cinsel ilişkiye girmek,1,always_euph
830,831,"Devrimci Sosyalist İşçi Partisi Genel Başkanı (DSİP) Doğan Tarkan kalp krizi nedeniye 65 yaşında [PET_BOUNDARY]vefat etti[PET_BOUNDARY]. Tarkan, 12 Eylül 1980 Darbesi sonrası yurtdışına kaçmış, Sosyalist İşçi gazetesini yurtdışında çıkarmış ve bu gazete çevresi ile birlikte DSİP'i kurmuştu. Türkiye'ye döndükten sonra 1997 yılından itibaren de parti genel başkanlığı yapmaktaydı. Sosyalist İşçi ve Altüst dergilerinde güncel yazılar yazıyordu.",vefat etmek,1,always_euph
1268,1269,"yanına gitti. Gelen ""Vatan"" gazetesinin Ankara muhabiriydi. Gülümseyerek Erkanlı'nın elini sıktı ve girizgâha [PET_BOUNDARY]hacet görmeden[PET_BOUNDARY] şak diye sordu: ""– Binbaşım, Bayar dün intihar etmiş. Biraz tafsilât istiyorum. Oradan geldiğinizi biliyorum. """,hacet görmek,0,sometimes_euph
2404,2405,"West End var . Windsor Farms, en iyi bilinen bölümleri arasındadır. West End ayrıca Laurel, Farmington gibi orta ve [PET_BOUNDARY]düşük gelirli[PET_BOUNDARY] mahalleleri ve Regency Alışveriş Merkezi'ni çevreleyen alanları içerir. Daha varlıklı bölgeler arasında Glen",düşük gelirli,1,sometimes_euph
1578,1579,". Yellenmek. Gözün görmeyeceği, kulağın duymayacağı bir şekilde uyumak. Ancak, göz görmez ama kulak duyarsa [PET_BOUNDARY]abdest bozulmaz[PET_BOUNDARY]. Delilik, sarhoşluk ve baygınlık gibi aklın yitirildiği durumlar. Bir zât der ki; ""Ey kardeşim! Ne vakit uyanacaksın",abdest bozmak,0,sometimes_euph
96,97,"Fenerbahçe derbisi öncesinde sosyal medya hesabından ""Ne kadar uzakta olsam da kalbim ve dualarım sizinle. Kupa aldığımız yerde sizlerden zafer [PET_BOUNDARY]bekliyorum[PET_BOUNDARY]"" mesajını yazarak Galatasaraylı oyunculara ve taraftarlara olan bağlılığını gösteren Felipe Melo’nun bu dileği Sarı - Kırmızılı yetkilileri mutlu etti. Derbi sonrası Melo’yu telefonla arayan kulüp görevlileri, Brezilyalı oyuncuya ""Yine biz şampiyon olacağız ve kutlamalara seni özel olarak çağıracağız"" mesajını iletti.",beklemek,0,sometimes_euph
1253,1254,"eserleri görerek ferahlık duymakta, müteselli olmaktayız. Elinizdeki bu kitabın değeri mevzuunda uzun söze [PET_BOUNDARY]hacet görmüyoruz[PET_BOUNDARY] . İhyau Ulum , İslâm kültürünün ve maârifinin bir şaheseridir. Bu herhangi bir kitâb değil, bir ilim irfan hikmet",hacet görmek,0,sometimes_euph
1489,1490,"artışı. Bazı ilaçlar (kalp, tansiyon ve doğum kontrol ilaçları) nöbete davetiye çıkarabilir. Özellikle hanımlarda [PET_BOUNDARY]muayyen günlere[PET_BOUNDARY] yakın veya hamileliğin ilk üç ayında ağrılar artabilir. Ayrıca migrenin soya çekimle de ilgisi vardır. Tedavi 1- Kriz",muayyen günü,1,sometimes_euph
1046,1047,370460        ENDÜSTRİYEL SİMBİYOZ “Simbiyoz” biyolojik bir terimdir ve [PET_BOUNDARY]iki canlının[PET_BOUNDARY] tek bir organizma gibi birbirleriyle yardımlaşarak bir arada yaşamaları anlamına gelmektedir.,iki canlı,0,sometimes_euph
1360,1361,"olur babasını. Sonra annesi kederinden hastalanır. Hatta biraz dramatik hale getirmek için şöyle diyelim; annesi [PET_BOUNDARY]ince hastalığa[PET_BOUNDARY] tutulur sevdiceğinin ölümünden sonra ve gözleri önünde erir, erir ve ölür. Kimsesi kalmamıştır Ankara'da",ince hastalık,1,sometimes_euph
650,651,"TFF, Nelson yaşamını yitirmesinin ardından formalarının altına Mandela tişörtü giyen iki yıldızı PFDK'ya sevk etti. Sporx'in haberine göre, TFF bugün 10.20'de Drogba ve Eboue'yi Futbol Oyun Kuralları Kural 4 ve Futbol Disiplin Talimatı [PET_BOUNDARY]madde[PET_BOUNDARY] 45'e aykırılıktan Profesyonel Disiplin Kurulu'na sevk etti. YILDIRIM DEMİRÖREN'E ABD'DEN ŞOK...",madde,0,sometimes_euph
1201,1202,"kepek ekmeği,hıyarla geçmiyo be güzelim. Ye iç keyfine bak sen! Geberip gitmeyecen mi bigün. Ferteyi çekmeyecen mi? [PET_BOUNDARY]Dört kolluda[PET_BOUNDARY] eşek cennetine uçmayacan mı? Ne diyor ünlü düşünür Biyo:""Hayat kısa iyi yaşa"" Ajanın Notu:Bunu yazan yazar sağlıklı",dört kollu,1,sometimes_euph
1296,1297,"çıktı. Kürtaj Yasasının Kapsamı Daha öncesinde, tecavüz sonrası veya annenin hayatı tehlikeye atılması sonucunda [PET_BOUNDARY]hamileliğin sonlandırılmasına[PET_BOUNDARY] izin veriliyordu. Şimdi ise yasa, 14. haftaya kadar isteğe göre hamileliğin sonlandırılması ve tedavinin devlet",hamileliği sonlandırmak,1,sometimes_euph
87,88,"Cumhurbaşkanı Abdullah Gül, bu akşam Çankaya Köşkü'nde devlet erkanına veda resepsiyonu verecek. Resepsiyonda Abdullah Gül'ün bir de veda konuşması yapması [PET_BOUNDARY]bekleniyor[PET_BOUNDARY]. CHP Genel Başkanı Kemal Kılıçdaroğlu bu resepsiyona katılamama kararı aldı. AKP'deki büyük kavga ile gözlerin çevrildiği Recep Tayyip Erdoğan ise Çankaya'daki resepsiyona katılacak.",beklemek,0,sometimes_euph
820,821,"11 yıl boyunca [PET_BOUNDARY]uyutulan[PET_BOUNDARY] Aparicio, 27 Ağustos’ta uyandırıldıktan sonra Federer’i sordu. Federer’in halen dünya 2 numarası olduğunu öğrenince şaşıran 29 yaşındaki taraftar, ""Federer’in emekli olduğunu düşünmüştüm. 34 yaşında hâlâ zirvede. 27 Grand Slam kazandığını duyduğumda şaşırdım"" dedi.",uyutmak,0,sometimes_euph
785,786,"Açıklamada, ""Sağlık durumu ciddiyetini korumakta, hayati tehlikesi devam etmektedir. [PET_BOUNDARY]Uyutulmaya[PET_BOUNDARY] devam edilen Oya Aydoğan'ın tekrar çekilen beyin tomografisinde, ödemin yapılan tedaviye cevap vermediği, yaygın olarak devam ettiği saptanmıştır. Yoğun bakımda hekimlerimiz tarafından gerekli tedavilerin uygulanmasına devam edilmektedir"" denildi. Oya Aydoğan'ın durumu ciddi... Ameliyat 12 saat sürdü Bülent Ersoy 'Oya'yı bana gösterin'",uyutmak,0,sometimes_euph
1214,1215,"kabartma bezemeler doldurulmuştur. Girişin üstündeki lünetin içinde Selçuklu çinilerinde de görüldüğü gibi [PET_BOUNDARY]dört kollu[PET_BOUNDARY] yıldızlar işlenmiş, bunların tam ortasına mühr-i Süleyman biçimindeki sekizli bir yıldız çerçevenin içine kitâbe",dört kollu,0,sometimes_euph
269,270,Ümitköy Lions Kulübü ile ABD Büyükelçiliği'nin desteğiyle Hakan Aysev'in  vereceği konser 8 Şubat Pazartesi günü gerçekleştirecek. ABD Büyükelçisi James Fraklin Jeffrey'in  eşi Gurdun Jeffrey ev sahipliğinde gerçekleştirilecek konserin tüm gelirleri [PET_BOUNDARY]engelliler[PET_BOUNDARY] ve eğitim burslarında kullanılacak. Konsere giriş ücreti ise 50 TL olarak belirlendi.,engelli,1,sometimes_euph
1640,1641,"yine deplasmanda. Evlerindeki ilk maçta yani 3. maçta ise 96-82 gibi net bir skorla kazanarak bana göre serinin [PET_BOUNDARY]fişini çektiler[PET_BOUNDARY]. O maçta Clyburn 24 sayı, 5 ribaund, 3 asist ile yıldızlaşmış, tam 4 isimden daha çift haneli skor katkısı almayı da",fiş çekmek,0,sometimes_euph
